{
  "schema_version": 1,
  "board_id": "PN52-EXPERTCENTER-0001",
  "bios_vendor": "American Megatrends International, LLC.",
  "bios_version": "0411",
  "spi_sha256": "9f86d081884c7d659a2feaa0c55ad015a3bf4f1b2b0b822cd15d6c15b0f00a08",
  "module_hashes_sha256": {
    "pei_core": "2c26b46b68ffc68ff99b453c1d30413413422d706483bfa0f98a5e886266e7ae",
    "dxe_core": "fcde2b2edba56bf408601fb721fe9b5c338d10ee429ea04fae5511b68fbf8fb9",
    "agesa": "18ac3e7343f016890c510e93f935261169d9e3f565436429830faf0934f4f8e4",
    "psp_dir": "3f79bb7b435b05321651daefd374cdc681dc06faa65e374e38337b88ca046dea"
  },
  "chipsec": {
    "bios_wp": true,
    "spi_lock": true,
    "smm_lock": true
  },
  "secure_boot": true,
  "ftpm": true,
  "pcr0": "60d0e0e3b5d6c5e8b3d2c1a0f9e8d7c6b5a4938271605f4e3d2c1b0a99887766",
  "pcr7": "a1b2c3d4e5f60718293a4b5c6d7e8f90112233445566778899aabbccddeeff00",
  "captured_at": "2026-06-27T10:00:00Z"
}
